{
  "$schema": "../game-manifest.schema.json",
  "schemaVersion": 1,
  "id": "texas-holdem",
  "displayName": "Texas Hold'em",
  "category": "card",
  "packageVersion": "0.1.0",
  "clientRoute": "/cards/texas-holdem",
  "apiBasePath": "/api/cards/texas-holdem/credit",
  "capabilities": ["credits", "multiplayer", "bots", "history"],
  "migrationState": "rules-pilot"
}
